{
  "title": "Kyu-latro!",
  "requires-steamodded": true,
  "requires-talisman": false,
  "categories": ["Resource Packs"],
  "author": "Finnaware",
  "repo": "https://github.com/Finnaware/Kyu-latro",
  "downloadURL": "https://github.com/Finnaware/Kyu-latro/archive/refs/heads/main.zip",
  "folderName": "Kyu-latro!",
  "version": "1.2.0",
  "automatic-version-check": true
}