{
  "title": "Entropy",
  "requires-steamodded": true,
  "requires-talisman": true,
  "categories": [
    "Content"
  ],
  "author": "Ruby",
  "repo": "https://github.com/lord-ruby/Entropy",
  "downloadURL": "https://github.com/lord-ruby/Entropy/archive/refs/heads/main.zip",
  "folderName": "Entropy",
  "version": "9d97855",
  "automatic-version-check": true
}
