{
  "title": "MagicSort",
  "requires-steamodded": true,
  "requires-talisman": false,
  "categories": [
    "Quality of Life"
  ],
  "author": "WUOTE",
  "repo": "https://github.com/acidflow-balatro/MagicSort",
  "downloadURL": "https://github.com/user-attachments/files/20731767/MagicSort.zip",
  "automatic-version-check": true,
  "version": "0.6.9 NICE"
}
