{
  "title": "Grim",
  "requires-steamodded": true,
  "requires-talisman": false,
  "categories": ["Content"],
  "author": "Mathguy",
  "repo": "https://github.com/Mathguy23/Grim",
  "automatic-version-check": true,
  "version": "18d57f5",
  "downloadURL": "https://github.com/Mathguy23/Grim/archive/refs/heads/main.zip"
}
