{
  "title": "cokelatro",
  "requires-steamodded": true,
  "requires-talisman": false,
  "categories": ["Content"],
  "author": "cokeblock",
  "repo": "https://github.com/cokeblock/Cokelatro",
  "downloadURL": "https://github.com/cokeblock/Cokelatro/releases/download/source-code.zip",
  "folderName": "cokelatro",
  "version": "1.0.0",
  "automatic-version-check": true
}
